series_index,series_title,question_number,level,points,image_url,local_image_path,A,B,C,D,correct_answer_text,correct_letter
29,Série 29,28,B2,21,https://qrcmv2rhibwpawwn.public.blob.vercel-storage.com/images/1767195004488-y57x1c.png,tcf_full_output\images\series_29_q28.png,Changer la façon de gérer des équipes.,Compenser le manque de formateurs.,Réussir au sein d'une société.,Transmettre des connaissances.,Transmettre des connaissances.,D
29,Série 29,29,B2,21,https://qrcmv2rhibwpawwn.public.blob.vercel-storage.com/images/1767195003887-n8cv9v.png,tcf_full_output\images\series_29_q29.png,Elles détruisent les cellules du cerveau.,Elles développent la mémoire à court terme.,Elles modifient nos processus cognitifs.,Elles provoquent la disparition de l'écriture.,Elles modifient nos processus cognitifs.,C
29,Série 29,30,C1,26,https://qrcmv2rhibwpawwn.public.blob.vercel-storage.com/images/1767195004024-ujikh1.png,tcf_full_output\images\series_29_q30.png,La gestion du stress est difficile.,La santé est mise en péril.,Le corps est moins réactif.,Le système génétique est affecté.,Le système génétique est affecté.,D
29,Série 29,31,C1,26,https://qrcmv2rhibwpawwn.public.blob.vercel-storage.com/images/1767195004469-81qkcg.png,tcf_full_output\images\series_29_q31.png,C'est la photographie qui est la forme d'art la moins valorisée.,Il y a peu d'événements culturels consacrés à la photographie.,Les photographies sont commercialisées à bas prix.,N'importe qui peut s'improviser photographe.,C'est la photographie qui est la forme d'art la moins valorisée.,A
29,Série 29,32,C1,26,https://qrcmv2rhibwpawwn.public.blob.vercel-storage.com/images/1767195003879-naa9ot.png,tcf_full_output\images\series_29_q32.png,De participer à l'exploration du monde numérique.,De restreindre le temps consacré aux jeux vidéo.,De sélectionner des contenus adaptés aux enfants.,De surveiller la navigation des jeunes sur la toile.,De participer à l'exploration du monde numérique.,A
29,Série 29,33,C1,26,https://qrcmv2rhibwpawwn.public.blob.vercel-storage.com/images/1767195004496-v9noy9.png,tcf_full_output\images\series_29_q33.png,L'absence de modèle comparatif de mobilité.,La déresponsabilisation des usagers.,Le déficit provoqué par son financement.,Le risque de saturation des réseaux.,Le risque de saturation des réseaux.,D
29,Série 29,34,C1,26,https://qrcmv2rhibwpawwn.public.blob.vercel-storage.com/images/1767195003910-zzwn0i.png,tcf_full_output\images\series_29_q34.png,Des méthodes innovantes sur l'usage des TIC.,Des pistes de recherche sur l'apprentissage.,Un état des lieux des ressources pédagogiques.,Une analyse du contexte socio-éducatif actuel.,Une analyse du contexte socio-éducatif actuel.,D
29,Série 29,35,C1,26,https://qrcmv2rhibwpawwn.public.blob.vercel-storage.com/images/1767195004414-03odfp.png,tcf_full_output\images\series_29_q35.png,Un esprit créatif dans le secteur des technologies Internet.,Une grande autonomie dans le domaine professionnel.,Une aptitude étonnante à savoir se mettre en avant.,Un esprit de solidarité avec les personnes sans emploi.,Une grande autonomie dans le domaine professionnel.,B
29,Série 29,36,C2,33,https://qrcmv2rhibwpawwn.public.blob.vercel-storage.com/images/1767195004477-z3pjqo.png,tcf_full_output\images\series_29_q36.png,Il revit des souvenirs lointains dans le bureau de la maison familiale.,Il se rappelle une pièce de travail poussiéreuse interdite aux enfants.,Il raconte son apprentissage de la lecture auprès de son grand-père.,Il évoque ses rentrées scolaires alors qu'il ne savait pas encore lire.,Il revit des souvenirs lointains dans le bureau de la maison familiale.,A
29,Série 29,37,C2,33,https://qrcmv2rhibwpawwn.public.blob.vercel-storage.com/images/1767195004546-vmd2zg.png,tcf_full_output\images\series_29_q37.png,Attirer davantage d'étudiants brillants.,Être à la pointe de la technologie.,Ouvrir ses cours à un public élargi.,Proposer des disciplines inédites.,Ouvrir ses cours à un public élargi.,C
29,Série 29,38,C2,33,https://qrcmv2rhibwpawwn.public.blob.vercel-storage.com/images/1767195003849-1zr029.png,tcf_full_output\images\series_29_q38.png,L'alternance entre le comique et le drame.,L'atmosphère énigmatique et inquiétante.,La présentation de particularités régionales.,L'émancipation des héros au cours du récit.,L'émancipation des héros au cours du récit.,D
29,Série 29,39,C2,33,https://qrcmv2rhibwpawwn.public.blob.vercel-storage.com/images/1767195003856-4t5pz4.png,tcf_full_output\images\series_29_q39.png,La dégradation des relations sociales à cause d'Internet.,La multiplication des sources d'information.,La nocivité des écrans sur le développement des enfants.,La recrudescence d'informations mensongères.,La multiplication des sources d'information.,B
30,Série 30,1,A1,3,https://qrcmv2rhibwpawwn.public.blob.vercel-storage.com/images/1767195026383-wo6chk.png,tcf_full_output\images\series_30_q01.png,Un événement.,Un horaire.,Un plan.,Une adresse.,Un horaire.,B
30,Série 30,2,A1,3,https://qrcmv2rhibwpawwn.public.blob.vercel-storage.com/images/1767195026387-vyljlz.png,tcf_full_output\images\series_30_q02.png,Des aliments.,Des livres.,Des meubles.,Des vêtements.,Des vêtements.,D
30,Série 30,3,A1,3,https://qrcmv2rhibwpawwn.public.blob.vercel-storage.com/images/1767195026567-89i436.png,tcf_full_output\images\series_30_q03.png,9 euros.,"12,50 euros.",16 euros.,20 euros.,16 euros.,C
30,Série 30,4,A1,3,https://qrcmv2rhibwpawwn.public.blob.vercel-storage.com/images/1767195026445-lgfaz1.png,tcf_full_output\images\series_30_q04.png,Elle doit lui écrire une lettre.,Elle doit lui écrire une carte.,Elle doit lui téléphoner.,Elle doit lui envoyer un message.,Elle doit lui téléphoner.,C
30,Série 30,5,A2,9,https://qrcmv2rhibwpawwn.public.blob.vercel-storage.com/images/1767195026429-kpkd11.png,tcf_full_output\images\series_30_q05.png,Découvrir la nourriture locale.,Gagner un repas traditionnel.,Prendre un cours de cuisine.,Visiter une ferme française.,Découvrir la nourriture locale.,A
30,Série 30,6,A2,9,https://qrcmv2rhibwpawwn.public.blob.vercel-storage.com/images/1767195026828-g0tdix.png,tcf_full_output\images\series_30_q06.png,Au personnel.,Aux étudiants.,Aux parents.,Aux professeurs.,Aux étudiants.,B
30,Série 30,7,A2,9,https://qrcmv2rhibwpawwn.public.blob.vercel-storage.com/images/1767195026456-2b8wsi.png,tcf_full_output\images\series_30_q07.png,Appeler pour réserver une place.,Dormir dans un lieu protégé.,Participer à une rencontre.,Régler leur facture avant de partir.,Dormir dans un lieu protégé.,B
30,Série 30,8,A2,9,https://qrcmv2rhibwpawwn.public.blob.vercel-storage.com/images/1767195026816-owo8sz.png,tcf_full_output\images\series_30_q08.png,Ils aiment en voir dans la nature.,Ils les regardent à la télévision.,Ils sont nombreux à en avoir.,Ils vont les voir dans les zoos.,Ils sont nombreux à en avoir.,C
30,Série 30,9,A2,9,https://qrcmv2rhibwpawwn.public.blob.vercel-storage.com/images/1767195026821-oaw0vh.png,tcf_full_output\images\series_30_q09.png,De donner des cours.,De garder des enfants.,De rencontrer des voisins.,De suivre des formations.,De donner des cours.,A
30,Série 30,10,A2,9,https://qrcmv2rhibwpawwn.public.blob.vercel-storage.com/images/1767195026418-9q30kv.png,tcf_full_output\images\series_30_q10.png,Un atelier de cuisine.,Un déménagement.,Une fête entre voisins.,Une visite d’appartement.,Une fête entre voisins.,C
30,Série 30,11,B1,15,https://qrcmv2rhibwpawwn.public.blob.vercel-storage.com/images/1767195026449-uheo4r.png,tcf_full_output\images\series_30_q11.png,De changer les poubelles.,De collecter du plastique.,De gagner une bicyclette.,De travailler pour la mairie.,De collecter du plastique.,B
30,Série 30,12,B1,15,https://qrcmv2rhibwpawwn.public.blob.vercel-storage.com/images/1767195026852-jx3gda.png,tcf_full_output\images\series_30_q12.png,De l’aide pour une association.,De nouveaux rayons jouets.,Un concours de jeux vidéo.,Une remise de 2 euros par article.,De l’aide pour une association.,A
30,Série 30,13,B1,15,https://qrcmv2rhibwpawwn.public.blob.vercel-storage.com/images/1767195026848-msb21a.png,tcf_full_output\images\series_30_q13.png,Elle compare leurs caractéristiques.,Elle les donne à des associations.,Elle les remet aux normes.,Elle les revend d’occasion.,Elle les revend d’occasion.,D
30,Série 30,14,B1,15,https://qrcmv2rhibwpawwn.public.blob.vercel-storage.com/images/1767195026533-pkkect.png,tcf_full_output\images\series_30_q14.png,D’aider à réaliser une fête.,D’assister à un concert.,De participer à un goûter.,De venir faire des achats.,De venir faire des achats.,D
30,Série 30,15,B1,15,https://qrcmv2rhibwpawwn.public.blob.vercel-storage.com/images/1767195026794-aurm3k.png,tcf_full_output\images\series_30_q15.png,Les étudiants préfèrent habiter seuls.,Les loyers ont augmenté avec la crise.,Les salariés sont attirés par la colocation.,Les sites d’habitat partagé se multiplient.,Les salariés sont attirés par la colocation.,C
30,Série 30,16,B1,15,https://qrcmv2rhibwpawwn.public.blob.vercel-storage.com/images/1767195026785-yk6hwf.png,tcf_full_output\images\series_30_q16.png,Pour lui annoncer un changement d’emploi du temps.,Pour lui confirmer l’expédition d’un courrier.,Pour lui rappeler l’importance d’une entrevue.,Pour lui signaler les absences répétées de son enfant.,Pour lui rappeler l’importance d’une entrevue.,C
30,Série 30,17,B1,15,https://qrcmv2rhibwpawwn.public.blob.vercel-storage.com/images/1767195026873-qs3m0f.png,tcf_full_output\images\series_30_q17.png,Elle abrite une vie animée.,Elle perpétue des traditions.,Elle se préserve du tourisme.,Elle tente d'imiter sa voisine.,Elle abrite une vie animée.,A
30,Série 30,18,B1,15,https://qrcmv2rhibwpawwn.public.blob.vercel-storage.com/images/1767195026504-77rml7.png,tcf_full_output\images\series_30_q18.png,Les producteurs évitent de prendre des risques.,Les réalisateurs sont à la recherche d'idées neuves.,Les scénaristes font preuve d'une imagination limitée.,Les spectateurs privilégient les créations classiques.,Les producteurs évitent de prendre des risques.,A
30,Série 30,19,B1,15,https://qrcmv2rhibwpawwn.public.blob.vercel-storage.com/images/1767195026466-8egkwp.png,tcf_full_output\images\series_30_q19.png,Un manque d’intérêt du grand public.,Un risque de déconcentration des joueurs.,Une moindre crédibilité des arbitres.,Une perte de spontanéité des matchs.,Une perte de spontanéité des matchs.,D
30,Série 30,20,B2,21,https://qrcmv2rhibwpawwn.public.blob.vercel-storage.com/images/1767195026487-dvm6x1.png,tcf_full_output\images\series_30_q20.png,Elle doit devenir la langue de l’administration publique.,Elle peut perdre son statut de langue dominante.,Elle restera la langue privilégiée dans le commerce.,Elle va provoquer la disparition de langues minoritaires.,Elle peut perdre son statut de langue dominante.,B
30,Série 30,21,B2,21,https://qrcmv2rhibwpawwn.public.blob.vercel-storage.com/images/1767195026598-tt1vmb.png,tcf_full_output\images\series_30_q21.png,Accéder à la propriété privée.,Avoir un mode de vie économique.,Participer à la vie associative.,Tenter une nouvelle aventure.,Tenter une nouvelle aventure.,D
30,Série 30,22,B2,21,https://qrcmv2rhibwpawwn.public.blob.vercel-storage.com/images/1767195026843-ujjy0x.png,tcf_full_output\images\series_30_q22.png,Acheter les meilleurs produits et dépenser le moins possible.,Avoir la garantie de la qualité du produit.,Être amateur de viande et militer pour le bien-être animal.,Privilégier les aliments bio et avoir du mal à s’en procurer.,Être amateur de viande et militer pour le bien-être animal.,C
30,Série 30,23,B2,21,https://qrcmv2rhibwpawwn.public.blob.vercel-storage.com/images/1767195026622-axddt8.png,tcf_full_output\images\series_30_q23.png,Parce qu’il y a eu des pluies importantes.,Parce que les femelles ont moins pondu.,Parce que les larves ont beaucoup mangé.,Parce qu’ils ont hiberné plus longtemps.,Parce que les larves ont beaucoup mangé.,C
30,Série 30,24,B2,21,https://qrcmv2rhibwpawwn.public.blob.vercel-storage.com/images/1767195026881-wx40rs.png,tcf_full_output\images\series_30_q24.png,Ils font preuve de solidarité économique avec les autres générations.,Ils sont à l’origine d’une part significative de l’épargne des banques.,La réforme des retraites influencera leurs comportements.,Leur pouvoir d’achat est garanti dans les pays industrialisés.,La réforme des retraites influencera leurs comportements.,C
30,Série 30,25,B2,21,https://qrcmv2rhibwpawwn.public.blob.vercel-storage.com/images/1767195026886-4k48tz.png,tcf_full_output\images\series_30_q25.png,À un vol interstellaire vers une planète lointaine.,À une expérience d’autosuffisance alimentaire.,À une exploration de cratères de volcans.,À une simulation de mission spatiale.,À une simulation de mission spatiale.,D
30,Série 30,26,B2,21,https://qrcmv2rhibwpawwn.public.blob.vercel-storage.com/images/1767195026499-cf9h14.png,tcf_full_output\images\series_30_q26.png,Pour demander une diminution des frais.,Pour dénoncer le manque d’entretien.,Pour exiger plus de variété de plantes.,Pour réclamer l’ouverture d’autres parcs.,Pour dénoncer le manque d’entretien.,B
30,Série 30,27,B2,21,https://qrcmv2rhibwpawwn.public.blob.vercel-storage.com/images/1767195026834-dheo0c.png,tcf_full_output\images\series_30_q27.png,Choisir les bons scénarios.,Interpréter certains rôles.,Obéir aux directives du réalisateur.,Respecter les textes au mot près.,Interpréter certains rôles.,B
30,Série 30,28,B2,21,https://qrcmv2rhibwpawwn.public.blob.vercel-storage.com/images/1767195026865-d3x7ak.png,tcf_full_output\images\series_30_q28.png,Démontrer les dégâts des méthodes de culture intensive.,Prouver l’efficacité des insectes contre les parasites.,Recommander des procédés de gestion durable de l’eau.,Vulgariser des techniques de rendement des terres.,Démontrer les dégâts des méthodes de culture intensive.,A
30,Série 30,29,B2,21,https://qrcmv2rhibwpawwn.public.blob.vercel-storage.com/images/1767195026518-1sol6x.png,tcf_full_output\images\series_30_q29.png,Ils donnent l’impression de vénérer les produits.,Ils ont l’air éblouis par le gigantisme des magasins.,Ils paraissent manipulés par une force supérieure.,Ils semblent perdus dans le labyrinthe des rayons.,Ils paraissent manipulés par une force supérieure.,C
30,Série 30,30,C1,26,https://qrcmv2rhibwpawwn.public.blob.vercel-storage.com/images/1767195026869-oivqsh.png,tcf_full_output\images\series_30_q30.png,Ce sont les violons récents qui sont les plus estimés.,l est difficile de maîtriser les violons anciens.,La qualité des violons évolue avec le temps.,Voir le violon modifie l’appréciation de l’auditeur.,Ce sont les violons récents qui sont les plus estimés.,A
30,Série 30,31,C1,26,https://qrcmv2rhibwpawwn.public.blob.vercel-storage.com/images/1767195026438-mb37m3.png,tcf_full_output\images\series_30_q31.png,Ils bouleversent les rapports d’autorité.,Ils évitent les postes à responsabilité.,Ils sont moins motivés que leurs ainés.,Ils tiennent à la stabilité de l’emploi.,Ils bouleversent les rapports d’autorité.,A
30,Série 30,32,C1,26,https://qrcmv2rhibwpawwn.public.blob.vercel-storage.com/images/1767195026394-q1z7q1.png,tcf_full_output\images\series_30_q32.png,Encourager le dialogue avec le public.,Former des acteurs en banlieue.,Réaliser une œuvre à plusieurs mains.,Sensibiliser à l’égalité des sexes.,Encourager le dialogue avec le public.,A
30,Série 30,33,C1,26,https://qrcmv2rhibwpawwn.public.blob.vercel-storage.com/images/1767195026734-u2nqw9.png,tcf_full_output\images\series_30_q33.png,Ils sont aptes à coloniser un territoire vierge.,Ils sont capables de communiquer entre eux.,Ils sont en compétition pour leur croissance.,Ils sont susceptibles de ressentir des émotions.,Ils sont capables de communiquer entre eux.,B
30,Série 30,34,C1,26,https://qrcmv2rhibwpawwn.public.blob.vercel-storage.com/images/1767195026412-l686fb.png,tcf_full_output\images\series_30_q34.png,Convaincre la clientèle ciblée.,Former les spécialistes du secteur.,Rentabiliser les projets à venir.,Restaurer d’anciens bâtiments.,Former les spécialistes du secteur.,B
30,Série 30,35,C1,26,https://qrcmv2rhibwpawwn.public.blob.vercel-storage.com/images/1767195026724-1ntucu.png,tcf_full_output\images\series_30_q35.png,Si c’est une occasion d’élargir son réseau social.,Si c’est une opportunité de changer de mode de vie.,Si c’est une possibilité de trouver un emploi.,Si c’est le fruit d’une décision personnelle.,Si c’est le fruit d’une décision personnelle.,D
30,Série 30,36,C2,33,https://qrcmv2rhibwpawwn.public.blob.vercel-storage.com/images/1767195026750-nc08dh.png,tcf_full_output\images\series_30_q36.png,Elle a accru la compétitivité industrielle.,Elle a amélioré les conditions de travail.,Elle a enrayé la hausse du chômage.,Elle a modifié l’organisation du travail.,Elle a modifié l’organisation du travail.,D
30,Série 30,37,C2,33,https://qrcmv2rhibwpawwn.public.blob.vercel-storage.com/images/1767195026674-uwgtyz.png,tcf_full_output\images\series_30_q37.png,Il analyse l’établissement d’une dynastie royale.,Il explique l’origine d’une légende médiévale.,Il explore la construction identitaire des Français.,Il renforce le mythe de la bataille de Bouvines.,Il explore la construction identitaire des Français.,C
30,Série 30,38,C2,33,https://qrcmv2rhibwpawwn.public.blob.vercel-storage.com/images/1767195026668-va9sqo.png,tcf_full_output\images\series_30_q38.png,L’alternance entre le comique et le drame.,L’atmosphère énigmatique et inquiétante.,La présentation de particularités régionales.,L’émancipation des héros au cours du récit.,L’émancipation des héros au cours du récit.,D
30,Série 30,39,C2,33,https://qrcmv2rhibwpawwn.public.blob.vercel-storage.com/images/1767195026609-3w9r0b.png,tcf_full_output\images\series_30_q39.png,Elle évoque la facilité de contrôle des savoirs comparativement aux ressources matérielles.,Elle suggère que les savoirs peuvent être facilement dirigés et contraints dans des règles standard.,Elle souligne la complexité de gérer une chose aussi insaisissable que le savoir tout en reconnaissant son importance pour la compétitivité des entreprises.,Elle affirme que les savoirs sont moins importants pour la compétitivité des entreprises que les ressources matérielles.,Elle souligne la complexité de gérer une chose aussi insaisissable que le savoir tout en reconnaissant son importance pour la compétitivité des entreprises.,C
31,Série 31,1,A1,3,https://qrcmv2rhibwpawwn.public.blob.vercel-storage.com/images/1767195030459-iqbqe7.png,tcf_full_output\images\series_31_q01.png,Donner des conseils.,Informer sur la météo.,Présenter des activités.,Proposer un menu.,Donner des conseils.,A
31,Série 31,2,A1,3,https://qrcmv2rhibwpawwn.public.blob.vercel-storage.com/images/1767195030385-y4ly9c.png,tcf_full_output\images\series_31_q02.png,Compléter des documents.,Demander un programme.,Prendre un rendez-vous.,Visiter un établissement.,Compléter des documents.,A
31,Série 31,3,A1,3,https://qrcmv2rhibwpawwn.public.blob.vercel-storage.com/images/1767195030871-aegstq.png,tcf_full_output\images\series_31_q03.png,Des ateliers pour enfants.,Du matériel de sport.,Un emploi à la montagne.,Une location de vacances.,Une location de vacances.,D
31,Série 31,4,A1,3,https://qrcmv2rhibwpawwn.public.blob.vercel-storage.com/images/1767195030383-7542sf.png,tcf_full_output\images\series_31_q04.png,Des achats de produits frais.,Des conseils pour maigrir.,Des recettes de cuisine.,Des repas livrés à domicile.,Des repas livrés à domicile.,D
31,Série 31,5,A2,9,https://qrcmv2rhibwpawwn.public.blob.vercel-storage.com/images/1767195030721-xefg7o.png,tcf_full_output\images\series_31_q05.png,Canadienne.,Espagnole.,Italienne,Mexicaine.,Espagnole.,B
31,Série 31,6,A2,9,https://qrcmv2rhibwpawwn.public.blob.vercel-storage.com/images/1767195030877-0qm6am.png,tcf_full_output\images\series_31_q06.png,D'écrire aux invités.,D'organiser la fête.,De garder des enfants.,De préparer des danses.,De garder des enfants.,C
31,Série 31,7,A2,9,https://qrcmv2rhibwpawwn.public.blob.vercel-storage.com/images/1767195030665-tcv1q2.png,tcf_full_output\images\series_31_q07.png,La boutique est fermée.,La commande est arrivée.,La facture est disponible.,La livraison est en retard.,La commande est arrivée.,B
31,Série 31,8,A2,9,https://qrcmv2rhibwpawwn.public.blob.vercel-storage.com/images/1767195030471-7ys0to.png,tcf_full_output\images\series_31_q08.png,Pour annoncer son déménagement.,Pour donner de ses nouvelles.,Pour inviter Lucie en vacances.,Pour remercier son amie.,Pour donner de ses nouvelles.,B
31,Série 31,9,A2,9,https://qrcmv2rhibwpawwn.public.blob.vercel-storage.com/images/1767195030651-y9cl2x.png,tcf_full_output\images\series_31_q09.png,Aller chercher un colis.,Échanger son achat.,Envoyer une lettre.,Réserver son article.,Aller chercher un colis.,A
31,Série 31,10,A2,9,https://qrcmv2rhibwpawwn.public.blob.vercel-storage.com/images/1767195030627-ooba6y.png,tcf_full_output\images\series_31_q10.png,Dessiner des bâtiments publics originaux.,Donner le goût du voyage aux habitants.,Inventer une ville facile à vivre pour tous.,Prévoir de nouveaux moyens de transport.,Inventer une ville facile à vivre pour tous.,C
31,Série 31,11,B1,15,https://qrcmv2rhibwpawwn.public.blob.vercel-storage.com/images/1767195030637-m5rk8r.png,tcf_full_output\images\series_31_q11.png,De changer les poubelles.,De collecter du plastique.,De gagner une bicyclette.,De travailler pour la mairie.,De collecter du plastique.,B
31,Série 31,12,B1,15,https://qrcmv2rhibwpawwn.public.blob.vercel-storage.com/images/1767195030647-ncz468.png,tcf_full_output\images\series_31_q12.png,L'anniversaire d'un magasin.,L'augmentation des ventes.,L'ouverture d'un commerce.,Le début des soldes d'été.,L'anniversaire d'un magasin.,A
31,Série 31,13,B1,15,https://qrcmv2rhibwpawwn.public.blob.vercel-storage.com/images/1767195031026-p4jzoa.png,tcf_full_output\images\series_31_q13.png,De parler de ses qualités personnelles.,De préparer un entretien d'embauche.,D'élaborer un curriculum vitae original.,D'insister sur sa formation universitaire.,De préparer un entretien d'embauche.,B
31,Série 31,14,B1,15,https://qrcmv2rhibwpawwn.public.blob.vercel-storage.com/images/1767195030569-ufhfpc.png,tcf_full_output\images\series_31_q14.png,Assister à des spectacles.,Obtenir de meilleures places.,Rencontrer des comédiens.,Suivre des visites guidées.,Assister à des spectacles.,A
31,Série 31,15,B1,15,https://qrcmv2rhibwpawwn.public.blob.vercel-storage.com/images/1767195030900-zwec55.png,tcf_full_output\images\series_31_q15.png,De l'utilisation du portable.,De la sécurité au volant.,Du bruit de la circulation.,Du vote d'une nouvelle loi.,De l'utilisation du portable.,A
31,Série 31,16,B1,15,https://qrcmv2rhibwpawwn.public.blob.vercel-storage.com/images/1767195030924-rqpndn.png,tcf_full_output\images\series_31_q16.png,De diffuser de la musique.,De réutiliser des objets.,De s'engager en politique.,De tourner des publicités.,De réutiliser des objets.,B
31,Série 31,17,B1,15,https://qrcmv2rhibwpawwn.public.blob.vercel-storage.com/images/1767195030616-a1kzmt.png,tcf_full_output\images\series_31_q17.png,Elle apprend le français.,Elle est dans sa famille..,Elle prépare un long voyage.,Elle visite le Royaume-Uni.,Elle est dans sa famille..,B
31,Série 31,18,B1,15,https://qrcmv2rhibwpawwn.public.blob.vercel-storage.com/images/1767195031096-acjs1q.png,tcf_full_output\images\series_31_q18.png,Ils apprennent à se servir correctement des réseaux sociaux.,Ils communiquent plus facilement avec l'instituteur.,Ils comprennent mieux l'intérêt des apprentissages proposés.,Ils sont plus attentifs après un moment de détente.,Ils comprennent mieux l'intérêt des apprentissages proposés.,C
31,Série 31,19,B1,15,https://qrcmv2rhibwpawwn.public.blob.vercel-storage.com/images/1767195030557-6fxvzu.png,tcf_full_output\images\series_31_q19.png,Le rôle joué par les historiens.,Le rythme de son avancement.,Le succès auprès du public.,Les personnes qui y travaillent.,Les personnes qui y travaillent.,D
31,Série 31,20,B2,21,https://qrcmv2rhibwpawwn.public.blob.vercel-storage.com/images/1767195031088-dql7u2.png,tcf_full_output\images\series_31_q20.png,La réputation de restaurants touristiques est menacée par Internet.,La technologie modifie la relation à la gastronomie.,Les grands chefs livrent leurs secrets sur des sites.,Les traditions culinaires peuvent se perpétuer grâce au numérique.,La technologie modifie la relation à la gastronomie.,B
31,Série 31,21,B2,21,https://qrcmv2rhibwpawwn.public.blob.vercel-storage.com/images/1767195030546-4qixgl.png,tcf_full_output\images\series_31_q21.png,L'adaptation de l'offre culinaire à la mode actuelle.,La baisse de la qualité des établissements.,La disparition graduelle de la cuisine traditionnelle.,L'hostilité des critiques spécialisés locaux.,L'adaptation de l'offre culinaire à la mode actuelle.,A
31,Série 31,22,B2,21,https://qrcmv2rhibwpawwn.public.blob.vercel-storage.com/images/1767195030913-ujlby7.png,tcf_full_output\images\series_31_q22.png,Effectuer un calcul.,Évoquer un fait divers.,Fournir un support.,Sélectionner un souvenir.,Sélectionner un souvenir.,D
31,Série 31,23,B2,21,https://qrcmv2rhibwpawwn.public.blob.vercel-storage.com/images/1767195030603-mvtyik.png,tcf_full_output\images\series_31_q23.png,Elle attire beaucoup d'investisseurs.,Elle enregistre des ventes record.,Elle recherche une clientèle aisée,Elle soutient l'esprit de création.,Elle soutient l'esprit de création.,D
