series_index,series_title,question_number,level,points,image_url,local_image_path,A,B,C,D,correct_answer_text,correct_letter
10,Série 10,27,B2,21,https://qrcmv2rhibwpawwn.public.blob.vercel-storage.com/images/1767194907702-tbj8fz.png,tcf_full_output\images\series_10_q27.png,Elle appauvrit le lexique courant,Elle modifie le rapport au temps,Elle provoque la fin du courrier postal,Elle transforme le geste graphique,Elle modifie le rapport au temps,B
10,Série 10,28,B2,21,https://qrcmv2rhibwpawwn.public.blob.vercel-storage.com/images/1767194907466-hzr7rw.png,tcf_full_output\images\series_10_q28.png,L’affection qu’elle portait à ses admirateurs,L’originalité qui caractérisait le choix de ses rôles,La générosité qu’elle manifestait dans sa vie,La séduction qui était son principal atout,La générosité qu’elle manifestait dans sa vie,C
10,Série 10,29,B2,21,https://qrcmv2rhibwpawwn.public.blob.vercel-storage.com/images/1767194907764-2ylkmd.png,tcf_full_output\images\series_10_q29.png,À concurrencer la liste des hauts lieux dressée par l’UNESCO,À définir les critères esthétiques de l’architecture européenne,À favoriser l’émergence de valeurs culturelles collectives,À réfléchir sur la place du tourisme et de l’économie en Europe,À favoriser l’émergence de valeurs culturelles collectives,C
10,Série 10,30,C1,26,https://qrcmv2rhibwpawwn.public.blob.vercel-storage.com/images/1767194907405-aiwjhf.png,tcf_full_output\images\series_10_q30.png,Demande à une cliente de payer l’intégralité de sa commande,Prévenir une cliente que sa commande sera livrée en retard,Confirmer à une cliente que sa commande a bien été expédiée,Prévenir un client qu’elle devra payer euros de frais d’envoi,Demande à une cliente de payer l’intégralité de sa commande,A
10,Série 10,31,C1,26,https://qrcmv2rhibwpawwn.public.blob.vercel-storage.com/images/1767194907777-t7ppu7.png,tcf_full_output\images\series_10_q31.png,Des blogueurs professionnels,Des étudiants climatologie,Des guides de montagne,Des passionnés de randonnée,Des passionnés de randonnée,D
10,Série 10,32,C1,26,https://qrcmv2rhibwpawwn.public.blob.vercel-storage.com/images/1767194907746-4rr7pj.png,tcf_full_output\images\series_10_q32.png,Il appréciait de lire les récits d’écrivains de sa génération,"Il était déjà, en son temps, un artiste reconnu par ses pairs",Il se plaisait à véhiculer une fausse image de lui-même,Il souffrait beaucoup à cause de son état mental fragile,"Il était déjà, en son temps, un artiste reconnu par ses pairs",B
10,Série 10,33,C1,26,https://qrcmv2rhibwpawwn.public.blob.vercel-storage.com/images/1767194907661-0kvrct.png,tcf_full_output\images\series_10_q33.png,C’est un indice de savoir-vivre,C’est un marqueur social,C’est un signe de respect,C’est une preuve d’éducation,C’est un marqueur social,B
10,Série 10,34,C1,26,https://qrcmv2rhibwpawwn.public.blob.vercel-storage.com/images/1767194907835-kwqlsz.png,tcf_full_output\images\series_10_q34.png,L’absence du père oblige les mères à mettre leur vie affective entre parenthèses,La société actuelle accepte mal qu’un enfant élevé uniquement par son père,Les pères considèrent que l’absence de la mère doit être absolument compensée,Les pères seuls reconstruisent vite une vie de couple après une séparation,La société actuelle accepte mal qu’un enfant élevé uniquement par son père,B
10,Série 10,35,C1,26,https://qrcmv2rhibwpawwn.public.blob.vercel-storage.com/images/1767194907647-2ppzzr.png,tcf_full_output\images\series_10_q35.png,L’écriture requiert les mêmes qualités pour une fiction ou un essai,Le raisonnement du penseur représente une entrave à la création,Les grands romans sont issus des réflexions théoriques d’un auteur,Les modes d’écriture du romancier et de l’intellectuel sont identiques,Le raisonnement du penseur représente une entrave à la création,B
10,Série 10,36,C2,33,https://qrcmv2rhibwpawwn.public.blob.vercel-storage.com/images/1767194907752-89tfau.png,tcf_full_output\images\series_10_q36.png,Il revit des souvenirs lointains dans le bureau de la maison familiale,Il se rappelle une pièce de travail poussiéreuse interdit aux enfants,Il raconte son apprentissage de la lecture auprès de son grand-père,Il évoque ses rentrées scolaires alors qu’il ne savait pas encore lire,Il revit des souvenirs lointains dans le bureau de la maison familiale,A
10,Série 10,37,C2,33,https://qrcmv2rhibwpawwn.public.blob.vercel-storage.com/images/1767194907565-7glhn3.png,tcf_full_output\images\series_10_q37.png,À s’acquitter d’un engagement moral,À s’affranchir d’une histoire ancienne,À se défaire d’un sentiment de culpabilité,À se justifier d’une action peu glorieuse,À s’affranchir d’une histoire ancienne,B
10,Série 10,38,C2,33,https://qrcmv2rhibwpawwn.public.blob.vercel-storage.com/images/1767194907788-wi49v7.png,tcf_full_output\images\series_10_q38.png,Contribue à améliorer les méthodes d’apprentissage,Il est indispensable pour accéder au monde professionnel,Il permet de certifier les compétences réelles d’un candidat,Il perturbe le processus d’acquisition des connaissances,Il perturbe le processus d’acquisition des connaissances,D
10,Série 10,39,C2,33,https://qrcmv2rhibwpawwn.public.blob.vercel-storage.com/images/1767194907797-f2pdwh.png,tcf_full_output\images\series_10_q39.png,Pour découvrir de nouvelles références,Pour posséder une bibliothèque fournie,Pour s’évader vers des horizons lointains,Pour trouver des remèdes à ses maux,Pour découvrir de nouvelles références,A
11,Série 11,1,A1,3,https://qrcmv2rhibwpawwn.public.blob.vercel-storage.com/images/1767194928776-jnsz87.png,tcf_full_output\images\series_11_q01.png,Un événement.,Un horaire.,Un plan.,Une adresse.,Un horaire.,B
11,Série 11,2,A1,3,https://qrcmv2rhibwpawwn.public.blob.vercel-storage.com/images/1767194928696-nzoif5.png,tcf_full_output\images\series_11_q02.png,Un cours.,Un spectacle.,Un travail.,Une visite.,Un travail.,C
11,Série 11,3,A1,3,https://qrcmv2rhibwpawwn.public.blob.vercel-storage.com/images/1767194927772-8vjthe.png,tcf_full_output\images\series_11_q03.png,À la gare.,À la maison.,Au cinéma.,Au travail.,À la maison.,B
11,Série 11,4,A1,3,https://qrcmv2rhibwpawwn.public.blob.vercel-storage.com/images/1767194927832-6nj0wa.png,tcf_full_output\images\series_11_q04.png,Ils achètent souvent des sucreries.,Ils font attention à l’argent.,Ils aiment préparer des desserts.,Ils ont une maison de vacances.,Ils font attention à l’argent.,B
11,Série 11,5,A2,9,https://qrcmv2rhibwpawwn.public.blob.vercel-storage.com/images/1767194927757-2b9z6t.png,tcf_full_output\images\series_11_q05.png,Une adresse.,Une date.,Un horaire.,Un tarif.,Un tarif.,D
11,Série 11,6,A2,9,https://qrcmv2rhibwpawwn.public.blob.vercel-storage.com/images/1767194928466-y3k8sn.png,tcf_full_output\images\series_11_q06.png,Il achète un livre.,Il apprend ses leçons.,Il fait du sport.,Il regarde un film.,Il fait du sport.,C
11,Série 11,7,A2,9,https://qrcmv2rhibwpawwn.public.blob.vercel-storage.com/images/1767194929079-x9q7me.png,tcf_full_output\images\series_11_q07.png,Il donne un conseil.,Il indique une fermeture.,Il invite à un dîner.,Il promet un cadeau.,Il promet un cadeau.,D
11,Série 11,8,A2,9,https://qrcmv2rhibwpawwn.public.blob.vercel-storage.com/images/1767194929562-t10lvg.png,tcf_full_output\images\series_11_q08.png,Pour passer un examen.,Pour prendre son diplôme.,Pour surveiller des candidats.,Pour s’inscrire à des cours.,Pour passer un examen.,A
11,Série 11,9,A2,9,https://qrcmv2rhibwpawwn.public.blob.vercel-storage.com/images/1767194928426-gdkz6d.png,tcf_full_output\images\series_11_q09.png,Il accepte de l’aider.,Il cherche une information.,Il l’invite à déjeuner.,Il organise un entretien.,Il accepte de l’aider.,A
11,Série 11,10,A2,9,https://qrcmv2rhibwpawwn.public.blob.vercel-storage.com/images/1767194928977-no5bng.png,tcf_full_output\images\series_11_q10.png,Il a un nouveau travail.,Il change d’adresse.,Il part en vacances.,Il s’inscrit à l’université.,Il change d’adresse.,B
11,Série 11,11,B1,15,https://qrcmv2rhibwpawwn.public.blob.vercel-storage.com/images/1767194928800-93xpw5.png,tcf_full_output\images\series_11_q11.png,À conseiller le promeneur.,À décrire les risques d’accident.,À prévoir le temps qu’il fera.,À signaler les accès interdits.,À conseiller le promeneur.,A
11,Série 11,12,B1,15,https://qrcmv2rhibwpawwn.public.blob.vercel-storage.com/images/1767194929003-oyow0c.png,tcf_full_output\images\series_11_q12.png,Accueillir les étudiants étrangers.,Faciliter la recherche d’emploi.,Préparer la rentrée universitaire.,Présenter de nouvelles formations.,Faciliter la recherche d’emploi.,B
11,Série 11,13,B1,15,https://qrcmv2rhibwpawwn.public.blob.vercel-storage.com/images/1767194929183-me2jhs.png,tcf_full_output\images\series_11_q13.png,C’est un amoureux de la région.,C’est un écrivain très célèbre.,C’est un membre de l’association.,C’est un spécialiste du sujet.,C’est un spécialiste du sujet.,D
11,Série 11,14,B1,15,https://qrcmv2rhibwpawwn.public.blob.vercel-storage.com/images/1767194928958-jhozaz.png,tcf_full_output\images\series_11_q14.png,Écouter des chansons.,Gagner des cadeaux.,Goûter des recettes.,Jouer dans un film.,Goûter des recettes.,C
11,Série 11,15,B1,15,https://qrcmv2rhibwpawwn.public.blob.vercel-storage.com/images/1767194928763-iy9kuj.png,tcf_full_output\images\series_11_q15.png,La difficulté de trouver un stage à l’étranger.,La nécessité de s’exiler pour pouvoir travailler.,Le manque de formation des jeunes diplômés.,Le niveau trop faible des salaires proposés.,La nécessité de s’exiler pour pouvoir travailler.,B
11,Série 11,16,B1,15,https://qrcmv2rhibwpawwn.public.blob.vercel-storage.com/images/1767194928568-udomoq.png,tcf_full_output\images\series_11_q16.png,Accélérer les interventions d’urgence.,Généraliser la conduite sans chauffeur.,Repérer les mauvais conducteurs.,Signaler les difficultés de circulation.,Signaler les difficultés de circulation.,D
11,Série 11,17,B1,15,https://qrcmv2rhibwpawwn.public.blob.vercel-storage.com/images/1767194928948-zeo44s.png,tcf_full_output\images\series_11_q17.png,Diriger un service de plusieurs salariés.,Effectuer des tâches administratives.,Tester des programmes informatiques.,Vérifier les finances de l’entreprise.,Effectuer des tâches administratives.,B
11,Série 11,18,B1,15,https://qrcmv2rhibwpawwn.public.blob.vercel-storage.com/images/1767194928551-sd6doj.png,tcf_full_output\images\series_11_q18.png,Aux familles qui ont des factures élevées.,Aux jeunes qui veulent vivre en colocation.,Aux locataires qui ont de faibles revenus.,Aux personnes qui achètent un logement.,Aux locataires qui ont de faibles revenus.,C
11,Série 11,19,B1,15,https://qrcmv2rhibwpawwn.public.blob.vercel-storage.com/images/1767194928282-d1qhgz.png,tcf_full_output\images\series_11_q19.png,De lutter contre les imitations.,D’en accroître la production.,De développer sa saveur.,De le faire davantage connaître.,De lutter contre les imitations.,A
11,Série 11,20,B2,21,https://qrcmv2rhibwpawwn.public.blob.vercel-storage.com/images/1767194928717-rkeock.png,tcf_full_output\images\series_11_q20.png,Il a avalé un mauvais morceau de fromage.,Il a trouvé quelque chose dans son fromage.,Il est tombé malade en mangeant du fromage.,Il s’est fait mal aux dents avec le fromage.,Il a trouvé quelque chose dans son fromage.,B
11,Série 11,21,B2,21,https://qrcmv2rhibwpawwn.public.blob.vercel-storage.com/images/1767194929423-a60l51.png,tcf_full_output\images\series_11_q21.png,Accéder à la propriété privée.,Avoir un mode de vie économique.,Participez à la vie associative.,Tenter une nouvelle aventure.,Tenter une nouvelle aventure.,D
11,Série 11,22,B2,21,https://qrcmv2rhibwpawwn.public.blob.vercel-storage.com/images/1767194928726-d0blow.png,tcf_full_output\images\series_11_q22.png,Parce qu’il y a eu des pluies importantes.,Parce que les femelles ont moins pondu.,Parce que les larves ont beaucoup mangé.,Parce qu’ils ont hiberné plus longtemps.,Parce que les larves ont beaucoup mangé.,C
11,Série 11,23,B2,21,https://qrcmv2rhibwpawwn.public.blob.vercel-storage.com/images/1767194928785-ml1qlm.png,tcf_full_output\images\series_11_q23.png,Des facilités d’irrigation.,Des moissons plus fréquentes.,Des paysans plus nombreux.,Des rendements en baisse.,Des rendements en baisse.,D
11,Série 11,24,B2,21,https://qrcmv2rhibwpawwn.public.blob.vercel-storage.com/images/1767194928115-la7bs1.png,tcf_full_output\images\series_11_q24.png,Rationaliser la gestion des associations.,Élargir le recrutement à de nouveaux bénévoles.,Former les responsables des associations.,Mieux communiquer sur l’utilisation des fonds.,Mieux communiquer sur l’utilisation des fonds.,D
11,Série 11,25,B2,21,https://qrcmv2rhibwpawwn.public.blob.vercel-storage.com/images/1767194928452-sv7jmm.png,tcf_full_output\images\series_11_q25.png,En envoyant des courriels sur la plateforme de l’émission.,En étant sélectionné pour être convié sur le plateau.,En joignant le standard de la chaîne pendant le direct.,En participant à distance au moyen d’une cybercaméra.,En envoyant des courriels sur la plateforme de l’émission.,A
11,Série 11,26,B2,21,https://qrcmv2rhibwpawwn.public.blob.vercel-storage.com/images/1767194928530-yj5mrk.png,tcf_full_output\images\series_11_q26.png,L’avenir de son travail est menacé par l’industrie agroalimentaire.,La qualité des produits charcutiers est reconnue par les médecins.,Le passage d’un métier de bouche à un autre se fait facilement.,L’image attachée à sa profession est stéréotypée et peu valorisante.,L’image attachée à sa profession est stéréotypée et peu valorisante.,D
11,Série 11,27,B2,21,https://qrcmv2rhibwpawwn.public.blob.vercel-storage.com/images/1767194928770-vzrrj5.png,tcf_full_output\images\series_11_q27.png,Obtenir de l’argent pour développer des centres d’accueil.,Convaincre les entreprises étrangères d’investir au Burundi.,Soutenir les étudiants burundais expatriés pour leurs études.,Trouver des bénévoles pour s’occuper des enfants à l’hôpital.,Obtenir de l’argent pour développer des centres d’accueil.,A
11,Série 11,28,B2,21,https://qrcmv2rhibwpawwn.public.blob.vercel-storage.com/images/1767194928732-cieia1.png,tcf_full_output\images\series_11_q28.png,L’harmonisation de leurs appellations.,La multiplication de leurs prédateurs.,La transformation de leur écosystème.,Le prélèvement abusif lié à leur surpêche.,L’harmonisation de leurs appellations.,A
11,Série 11,29,B2,21,https://qrcmv2rhibwpawwn.public.blob.vercel-storage.com/images/1767194929054-w0q6jf.png,tcf_full_output\images\series_11_q29.png,Il constate la fréquence des modifications apportées aux photos.,Il espère la disparition des corrections sur les photos.,Il souligne la place grandissante des photos par rapport au texte.,Il vante la grande qualité artistique des photos de célébrités.,Il constate la fréquence des modifications apportées aux photos.,A
11,Série 11,30,C1,26,https://qrcmv2rhibwpawwn.public.blob.vercel-storage.com/images/1767194929060-abhltg.png,tcf_full_output\images\series_11_q30.png,La complémentarité des supports médiatiques.,La rivalité entre les différents médias.,La spécificité des médias français.,Le développement des médias en ligne.,La rivalité entre les différents médias.,B
11,Série 11,31,C1,26,https://qrcmv2rhibwpawwn.public.blob.vercel-storage.com/images/1767194928833-45waiw.png,tcf_full_output\images\series_11_q31.png,Les coûts élevés des investissements.,Les faibles qualifications des employés.,Les réticences émises par la clientèle.,Les spécificités de certains métiers.,Les réticences émises par la clientèle.,C
11,Série 11,32,C1,26,https://qrcmv2rhibwpawwn.public.blob.vercel-storage.com/images/1767194929190-vdrf7e.png,tcf_full_output\images\series_11_q32.png,D’anciens artistes ont l’occasion de monter sur scène.,Les financements publics contribuent à leur expansion.,Les organisateurs s’adaptent aux nouvelles tendances.,Les tarifs proposés dépendant de la programmation.,Les financements publics contribuent à leur expansion.,B
11,Série 11,33,C1,26,https://qrcmv2rhibwpawwn.public.blob.vercel-storage.com/images/1767194929478-mhqb8r.png,tcf_full_output\images\series_11_q33.png,Elle concerne uniquement les économies fortes.,Elle freine l’utilisation de ressources renouvelables.,Elle permet le dépassement des normes édictées.,Elle ralentit le progrès dans les États émergents.,Elle permet le dépassement des normes édictées.,C
11,Série 11,34,C1,26,https://qrcmv2rhibwpawwn.public.blob.vercel-storage.com/images/1767194930016-0nr653.png,tcf_full_output\images\series_11_q34.png,L’idée de démocratie est aujourd’hui plus controversée qu’avant.,La démocratie est affaiblie par la diversité de ses formes.,La mise en place de la démocratie résulte d’un long processus.,Les fondements théoriques de la démocratie sont utopiques.,La mise en place de la démocratie résulte d’un long processus.,C
11,Série 11,35,C1,26,https://qrcmv2rhibwpawwn.public.blob.vercel-storage.com/images/1767194928755-a1x591.png,tcf_full_output\images\series_11_q35.png,Il apaise les tensions de la société.,Il insiste sur le point de vue matériel.,Il propose des programmes utopiques.,Il traite les problèmes liés aux sols.,Il insiste sur le point de vue matériel.,B
11,Série 11,36,C2,33,https://qrcmv2rhibwpawwn.public.blob.vercel-storage.com/images/1767194929458-hl69cc.png,tcf_full_output\images\series_11_q36.png,L’écologie est avant tout une affaire d’État.,La concertation est la clé d’une action réussie.,Les mesures protectionnistes sont dépassées.,L’influence des lobbies est à prendre en compte.,La concertation est la clé d’une action réussie.,B
11,Série 11,37,C2,33,https://qrcmv2rhibwpawwn.public.blob.vercel-storage.com/images/1767194928510-blxgti.png,tcf_full_output\images\series_11_q37.png,La Commission européenne est en désaccord avec les autorités.,Le contenu des programmes universitaires est inadapté à la vie active.,Le discours sur la formation continue s’oppose à la réalité observée.,L’obtention de diplômes cesse d’assurer l’avenir professionnel des jeunes.,Le discours sur la formation continue s’oppose à la réalité observée.,C
11,Série 11,38,C2,33,https://qrcmv2rhibwpawwn.public.blob.vercel-storage.com/images/1767194929161-7fc9hp.png,tcf_full_output\images\series_11_q38.png,Ils ont une influence très préoccupante sur l’économie.,Ils se produisent dans les entreprises industrielles.,Ils sont remplacés par des pathologies professionnelles.,Ils sont source de traumatismes musculaires graves.,Ils sont remplacés par des pathologies professionnelles.,C
11,Série 11,39,C2,33,https://qrcmv2rhibwpawwn.public.blob.vercel-storage.com/images/1767194928523-99f4d6.png,tcf_full_output\images\series_11_q39.png,L’aisance de l’acteur qui tient le rôle principal.,La finesse de l’humour présente dans la pièce.,Le mystère qui entoure le personnage.,Le talent de l’ensemble des musiciens.,L’aisance de l’acteur qui tient le rôle principal.,A
12,Série 12,1,A1,3,https://qrcmv2rhibwpawwn.public.blob.vercel-storage.com/images/1767194933091-9u135e.png,tcf_full_output\images\series_12_q01.png,Frapper et entrer.,Prendre rendez-vous.,Revenir plus tard.,Téléphoner.,Revenir plus tard.,C
12,Série 12,2,A1,3,https://qrcmv2rhibwpawwn.public.blob.vercel-storage.com/images/1767194932966-568unp.png,tcf_full_output\images\series_12_q02.png,Des cours particuliers.,Des jobs pendant le week-end.,Des rencontres entre jeunes.,Des voyages à l’étranger.,Des rencontres entre jeunes.,C
12,Série 12,3,A1,3,https://qrcmv2rhibwpawwn.public.blob.vercel-storage.com/images/1767194931784-j0rrir.png,tcf_full_output\images\series_12_q03.png,Il annonce son absence.,Il donne un rendez-vous.,Il indique son arrivée.,Il signale son retard.,Il annonce son absence.,A
12,Série 12,4,A1,3,https://qrcmv2rhibwpawwn.public.blob.vercel-storage.com/images/1767194931802-cqemzd.png,tcf_full_output\images\series_12_q04.png,Apprendre à jouer d’un instrument.,Assister à des concerts.,Réserver des billets de spectacle.,S’inscrire à des animations.,Assister à des concerts.,B
12,Série 12,5,A2,9,https://qrcmv2rhibwpawwn.public.blob.vercel-storage.com/images/1767194932884-3zv7sr.png,tcf_full_output\images\series_12_q05.png,Elle doit partir une journée.,Elle propose un déjeuner.,Elle souhaite parler à Françoise.,Elle veut visiter une entreprise.,Elle souhaite parler à Françoise.,C
12,Série 12,6,A2,9,https://qrcmv2rhibwpawwn.public.blob.vercel-storage.com/images/1767194932769-bd01bk.png,tcf_full_output\images\series_12_q06.png,Aller à un anniversaire.,Dîner avec son amie.,Partir en week-end.,Regarder des films.,Regarder des films.,D
12,Série 12,7,A2,9,https://qrcmv2rhibwpawwn.public.blob.vercel-storage.com/images/1767194933207-dd8122.png,tcf_full_output\images\series_12_q07.png,Pour annoncer un changement.,Pour inviter les élèves à une réunion.,Pour modifier l’horaire d’un cours.,Pour remercier les élèves de 5e B.,Pour modifier l’horaire d’un cours.,C
12,Série 12,8,A2,9,https://qrcmv2rhibwpawwn.public.blob.vercel-storage.com/images/1767194933841-5elz9k.png,tcf_full_output\images\series_12_q08.png,Beaux.,Calmes.,Courageux.,Joyeux.,Joyeux.,D
12,Série 12,9,A2,9,https://qrcmv2rhibwpawwn.public.blob.vercel-storage.com/images/1767194932678-h24exn.png,tcf_full_output\images\series_12_q09.png,À des clients.,À madame Létourneau.,À des élèves.,À des employés.,À des employés.,D
12,Série 12,10,A2,9,https://qrcmv2rhibwpawwn.public.blob.vercel-storage.com/images/1767194933037-w4o7tj.png,tcf_full_output\images\series_12_q10.png,Aux élèves.,Aux étudiants.,Aux parents.,Aux professeurs.,Aux professeurs.,D
12,Série 12,11,B1,15,https://qrcmv2rhibwpawwn.public.blob.vercel-storage.com/images/1767194932841-eif5r7.png,tcf_full_output\images\series_12_q11.png,"Non, parce que c’est une réaction normale.",Bien sûr ! il existe des médicaments très efficaces.,"Oui, grâce à des méthodes très simples.",Certainement pas. Il est insurmontable.,"Oui, grâce à des méthodes très simples.",C
12,Série 12,12,B1,15,https://qrcmv2rhibwpawwn.public.blob.vercel-storage.com/images/1767194932932-ohh8e4.png,tcf_full_output\images\series_12_q12.png,Pour accueillir des élèves handicapés.,Pour favoriser une autre pédagogie.,Pour limiter les problèmes de santé.,Pour rénover les salles de classe.,Pour rénover les salles de classe.,D
12,Série 12,13,B1,15,https://qrcmv2rhibwpawwn.public.blob.vercel-storage.com/images/1767194933058-wivy9d.png,tcf_full_output\images\series_12_q13.png,Elle demande un remboursement.,Elle doit prendre un rendez-vous.,Elle souhaite des renseignements.,Elle veut faire une réclamation.,Elle souhaite des renseignements.,C
12,Série 12,14,B1,15,https://qrcmv2rhibwpawwn.public.blob.vercel-storage.com/images/1767194933237-r1cxh1.png,tcf_full_output\images\series_12_q14.png,Échanger son appartement pendant l’été.,Louer un appartement meublé de m².,Partager son appartement pour deux mois.,Vendre son appartement près de Paris.,Partager son appartement pour deux mois.,C
12,Série 12,15,B1,15,https://qrcmv2rhibwpawwn.public.blob.vercel-storage.com/images/1767194933098-cjz7y5.png,tcf_full_output\images\series_12_q15.png,Demander des informations sur des produits.,Passer une commande de produits.,Présenter de nouveaux produits.,Proposer une dégustation de produit.,Présenter de nouveaux produits.,C
12,Série 12,16,B1,15,https://qrcmv2rhibwpawwn.public.blob.vercel-storage.com/images/1767194932702-fcbd7d.png,tcf_full_output\images\series_12_q16.png,Baisser les salaires.,Créer des emplois.,Diviser le travail.,Favoriser la recherche.,Créer des emplois.,B
12,Série 12,17,B1,15,https://qrcmv2rhibwpawwn.public.blob.vercel-storage.com/images/1767194933523-6s96c6.png,tcf_full_output\images\series_12_q17.png,Exposer l’ensemble de ses qualités professionnelles.,Faire la preuve de son désir de travailler.,Parler avec enthousiasme de ses projets de formations.,Parler des emplois qu’on a déjà occupés.,Faire la preuve de son désir de travailler.,B
12,Série 12,18,B1,15,https://qrcmv2rhibwpawwn.public.blob.vercel-storage.com/images/1767194932990-fo4dwo.png,tcf_full_output\images\series_12_q18.png,Informer sur de nouvelles méthodes éducatives.,Montrer la vie de tous les jours d’un jeune couple.,Présenter les relations familiales avec humour.,Proposer des solutions à des situations de crise.,Présenter les relations familiales avec humour.,C
12,Série 12,19,B1,15,https://qrcmv2rhibwpawwn.public.blob.vercel-storage.com/images/1767194931874-9zhpo1.png,tcf_full_output\images\series_12_q19.png,Accéder à la propriété privée.,Avoir un mode de vie économique.,Participer à la vie associative.,Tenter une nouvelle aventure.,Tenter une nouvelle aventure.,D
12,Série 12,20,B2,21,https://qrcmv2rhibwpawwn.public.blob.vercel-storage.com/images/1767194932863-wbu3eu.png,tcf_full_output\images\series_12_q20.png,Moderniser les installations anti-pollution.,Modifier les circuits de production.,Organiser des formations sur le sujet.,Responsabiliser les acteurs concernés.,Responsabiliser les acteurs concernés.,D
